{
  "schema_version": "harness.finding/v1",
  "finding_id": "FIND-001",
  "review_profile": "TECH_REVIEWER",
  "owner_role": "IMPLEMENTER",
  "work_item_id": "HNS-CORE-003",
  "artifact_ref": { "kind": "source", "path": "harness/src/schemas/registry.ts" },
  "artifact_hash": "sha256:eeeeeeeeeeeeeeeeeeeeeeeeeeeeeeeeeeeeeeeeeeeeeeeeeeeeeeeeeeeeeeee",
  "requirement_references": [{ "kind": "acceptance-criterion", "id": "AC-HNS-CORE-003-001", "path": "work-items/HNS-CORE-003.md" }],
  "description": "Representative schema finding.",
  "severity": "MINOR",
  "evidence_references": ["unit-test"],
  "required_action": "Correct the registry behavior.",
  "status": "OPEN"
}
